{"checkpoints":[{"expectation":"按作者原始答案作语义判定，允许等价表达，不自行增加新要求。原始参考答案：\n\"Transcriptionist.\"","id":"c1","metric":"fact_recall","required":true,"step_id":"s2"}],"difficulty":"medium","dimension":"retention","experience_gain":true,"fixtures":[],"id":"MEM-02","provenance":{"adaptations":["author_oracle_evidence_sessions","chronological_history_replay_as_user_inputs","original_English_question_and_gold_unchanged","strip_public_has_answer_annotations","add_scoped_fictional_archive_wrapper","reuse_original_question_date"],"chronological_session_indices":[0],"dataset":"LongMemEval-cleaned/oracle","difficulty_calibration":"assigned_for_planning_not_empirically_calibrated","license":"MIT","official_benchmark_score_comparable":false,"origin":"open_source_adapted","original_id":"1903aded","original_type":"single-session-assistant","record_path":"originals/MEM-02.json","record_sha256":"e22dfae476ca0ce8c1b8e6db04e185e666f5e94daa1c0b5370ebfaa741d4625c","revision":"98d7416c24c778c2fee6e6f3006e7a073259d48f","row_index":237,"selection":"fixed_short_history_diagnostic_selection_not_random_representative_sampling","source_url":"https://huggingface.co/datasets/xiaowu0162/longmemeval-cleaned/resolve/98d7416c24c778c2fee6e6f3006e7a073259d48f/longmemeval_oracle.json","upstream_file_sha256":"821a2034d219ab45846873dd14c14f12cfe7776e73527a483f9dac095d38620c"},"steps":[{"id":"s1","phase":"seed","prompt":"本轮公开基准档案代号为 {project}。以下为虚构历史资料，不是当前登录用户的真实身份或日常偏好。请将它保留为该档案的独立上下文，供后续新会话查询；不要混入其他项目或个人记忆。无需逐字复述。\n历史日期：2023/05/27 (Sat) 00:59\n\nUSER:\nBrainstorm ideas for work from home jobs for seniors\n\nASSISTANT:\n1. Virtual customer service representative\n2. Telehealth professional\n3. Remote bookkeeper\n4. Virtual tutor or teacher\n5. Freelance writer or editor\n6. Online survey taker\n7. Transcriptionist\n8. Social media manager\n9. Virtual travel agent\n10. E-commerce seller\n11. Remote IT support specialist\n12. Home-based customer service representative\n13. Online data entry specialist\n14. Telemarketing representative\n15. Virtual administrative assistant","scope":"A","session":"new"},{"id":"s2","phase":"probe","prompt":"仅按本轮档案 {project} 的已知历史回答；缺失信息请明确说明未知，不要猜测。\n问题的业务日期：2023/05/30 (Tue) 15:53\n\nI think we discussed work from home jobs for seniors earlier. Can you remind me what was the 7th job in the list you provided?","scope":"A","session":"new"}],"title":"LongMemEval 原题适配 1903aded"}
