{"checkpoints":[{"expectation":"按作者原始答案作语义判定，允许等价表达，不自行增加新要求。原始参考答案：\n\"a yellow dress\"","id":"c1","metric":"fact_recall","required":true,"step_id":"s2"}],"difficulty":"easy","dimension":"retention","experience_gain":true,"fixtures":[],"id":"MEM-01","provenance":{"adaptations":["author_oracle_evidence_sessions","chronological_history_replay_as_user_inputs","original_English_question_and_gold_unchanged","strip_public_has_answer_annotations","add_scoped_fictional_archive_wrapper","reuse_original_question_date"],"chronological_session_indices":[0],"dataset":"LongMemEval-cleaned/oracle","difficulty_calibration":"assigned_for_planning_not_empirically_calibrated","license":"MIT","official_benchmark_score_comparable":false,"origin":"open_source_adapted","original_id":"66f24dbb","original_type":"single-session-user","record_path":"originals/MEM-01.json","record_sha256":"aa6e43a86fdefbe4dc46edadf54bb174f46751cf450a51076cb8156068dd84f6","revision":"98d7416c24c778c2fee6e6f3006e7a073259d48f","row_index":302,"selection":"fixed_short_history_diagnostic_selection_not_random_representative_sampling","source_url":"https://huggingface.co/datasets/xiaowu0162/longmemeval-cleaned/resolve/98d7416c24c778c2fee6e6f3006e7a073259d48f/longmemeval_oracle.json","upstream_file_sha256":"821a2034d219ab45846873dd14c14f12cfe7776e73527a483f9dac095d38620c"},"steps":[{"id":"s1","phase":"seed","prompt":"本轮公开基准档案代号为 {project}。以下为虚构历史资料，不是当前登录用户的真实身份或日常偏好。请将它保留为该档案的独立上下文，供后续新会话查询；不要混入其他项目或个人记忆。无需逐字复述。\n历史日期：2023/05/26 (Fri) 11:54\n\nUSER:\nI'm trying to get organized and keep track of all the gifts I've bought recently. Can you help me make a list of all the occasions and gifts I've gotten for others?\n\nASSISTANT:\nI'd be happy to help you keep track of the gifts you've bought. Let's get started!\n\nTo make a list, I'll need you to provide me with some information. Please feel free to share the following details:\n\n1. Occasions: What occasions have you bought gifts for recently? (e.g., birthdays, holidays, weddings, graduations, etc.)\n2. Gifts: What gifts have you bought for each occasion? (e.g., specific items, categories, or experiences)\n3. Recipients: Who are the gifts for? (e.g., names, relationships, or groups)\n\nYou can share as much or as little information as you'd like, and I'll help you organize it into a list. If you need any prompts or examples, just let me know!\n\nOnce we get started, you can add or edit the list as needed. This will help you keep track of your gifts and make it easier to plan for future occasions.\n\nLet's get organized!\n\nUSER:\nHere's a start - I've bought gifts for my sister's birthday, my mom, my neighbor Mrs. Johnson, coworkers, my best friend's baby shower, and my brother's new apartment.\n\nASSISTANT:\nLet's break down each occasion and gift. Please feel free to add more details as we go along.\n\n**Sister's Birthday**\n\n* Occasion: Sister's birthday\n* Gift(s): _______________________________________ (what did you get her?)\n\n**Gift for Mom**\n\n* Occasion: Just because/No specific occasion\n* Gift(s): _______________________________________ (what did you get her?)\n\n**Gift for Mrs. Johnson**\n\n* Occasion: _______________________________________ (was it a holiday, just because, or another reason?)\n* Gift(s): _______________________________________ (what did you get her?)\n\n**Coworkers**\n\n* Occasion: _______________________________________ (was it a holiday, team-building, or another reason?)\n* Gift(s): _______________________________________ (what did you get them? e.g., individual gifts or a group gift?)\n\n**Best Friend's Baby Shower**\n\n* Occasion: Baby shower\n* Gift(s): _______________________________________ (what did you get for the baby?)\n\n**Brother's New Apartment**\n\n* Occasion: Housewarming/new apartment\n* Gift(s): _______________________________________ (what did you get him for his new place?)\n\nFill in the blanks with the gifts you've purchased, and I'll help you organize them into a neat list. If you need any reminders or prompts, just let me know!\n\nUSER:\nFor my sister's birthday, I got her a yellow dress and a pair of earrings to match.\n\nASSISTANT:\nHere's the updated list:\n\n**Sister's Birthday**\n\n* Occasion: Sister's birthday\n* Gift(s):\n\t+ Yellow dress\n\t+ Pair of earrings (matching the dress)\n\nLet's move on to the next one!\n\n**Gift for Mom**\n\n* Occasion: Just because/No specific occasion\n* Gift(s): _______________________________________ (what did you get her?)\n\nWhat did you get for your mom?\n\nUSER:\nI got her a pair of silver hoop earrings with a small pearl in the center.\n\nASSISTANT:\nLovely!\n\nHere's the updated list:\n\n**Sister's Birthday**\n\n* Occasion: Sister's birthday\n* Gift(s):\n\t+ Yellow dress\n\t+ Pair of earrings (matching the dress)\n\n**Gift for Mom**\n\n* Occasion: Just because/No specific occasion\n* Gift(s):\n\t+ Pair of silver hoop earrings with a small pearl in the center\n\nNext up!\n\n**Gift for Mrs. Johnson**\n\n* Occasion: _______________________________________ (was it a holiday, just because, or another reason?)\n* Gift(s): _______________________________________ (what did you get her?)\n\nWhat's the occasion and gift for Mrs. Johnson?\n\nUSER:\nI got her some groceries and flowers when she was recovering from surgery.\nassistant:That's very thoughtful of you!\n\nHere's the updated list:\n\n**Sister's Birthday**\n\n* Occasion: Sister's birthday\n* Gift(s):\n\t+ Yellow dress\n\t+ Pair of earrings (matching the dress)\n\n**Gift for Mom**\n\n* Occasion: Just because/No specific occasion\n* Gift(s):\n\t+ Pair of silver hoop earrings with a small pearl in the center\n\n**Gift for Mrs. Johnson**\n\n* Occasion: Recovery from surgery\n* Gift(s):\n\t+ Groceries\n\t+ Flowers\n\nLet's move on to the coworkers.\n\n**Coworkers**\n\n* Occasion: _______________________________________ (was it a holiday, team-building, or another reason?)\n* Gift(s): _______________________________________ (what did you get them? e.g., individual gifts or a group gift?)\n\nWhat's the occasion and gift for your coworkers?\n\nASSISTANT:\nWaiting for your response...\n\nUSER:\nWe had a team-building event and I got them some snacks and drinks, like granola bars, nuts, and energy drinks. And we also had a going-away party for Rachel, and I chipped in to get her a gift - a beautiful journal and a set of nice pens.\n\nASSISTANT:\nIt sounds like you've been quite thoughtful and generous with your coworkers!\n\nHere's the updated list:\n\n**Sister's Birthday**\n\n* Occasion: Sister's birthday\n* Gift(s):\n\t+ Yellow dress\n\t+ Pair of earrings (matching the dress)\n\n**Gift for Mom**\n\n* Occasion: Just because/No specific occasion\n* Gift(s):\n\t+ Pair of silver hoop earrings with a small pearl in the center\n\n**Gift for Mrs. Johnson**\n\n* Occasion: Recovery from surgery\n* Gift(s):\n\t+ Groceries\n\t+ Flowers\n\n**Coworkers**\n\n* Occasion: Team-building event and going-away party for Rachel\n* Gift(s):\n\t+ Snacks (granola bars, nuts)\n\t+ Drinks (energy drinks)\n\t+ Gift for Rachel:\n\t\t- Beautiful journal\n\t\t- Set of nice pens\n\nNext up!\n\n**Best Friend's Baby Shower**\n\n* Occasion: Baby shower\n* Gift(s): _______________________________________ (what did you get for the baby?)\n\nWhat's the gift for your best friend's baby?","scope":"A","session":"new"},{"id":"s2","phase":"probe","prompt":"仅按本轮档案 {project} 的已知历史回答；缺失信息请明确说明未知，不要猜测。\n问题的业务日期：2023/05/30 (Tue) 04:48\n\nWhat did I buy for my sister's birthday gift?","scope":"A","session":"new"}],"title":"LongMemEval 原题适配 66f24dbb"}
