{
  "id": "MEM-07",
  "dimension": "temporal",
  "title": "分散约束的联合安排",
  "difficulty": "hard",
  "experience_gain": true,
  "fixtures": [],
  "steps": [
    {
      "id": "s1",
      "phase": "seed",
      "prompt": "合成安排项目 {project}：参与人李青仅周二上午有空，沈知仅周二10:00到12:00有空。",
      "session": "new",
      "scope": "A"
    },
    {
      "id": "s2",
      "phase": "seed",
      "prompt": "补充 {project}：会议室只在周二10:30到11:30可用，复盘须45分钟。",
      "session": "new",
      "scope": "A"
    },
    {
      "id": "s3",
      "phase": "seed",
      "prompt": "再补充 {project}：李青在11:15必须离开，沈知可以线上参加。",
      "session": "new",
      "scope": "A"
    },
    {
      "id": "s4",
      "phase": "probe",
      "prompt": "请为 {project} 给出可执行的复盘时间、时长和参会方式，说明主要约束，不重复询问已知条件。",
      "session": "new",
      "scope": "A"
    }
  ],
  "checkpoints": [
    {
      "id": "c1",
      "step_id": "s4",
      "metric": "temporal_accuracy",
      "expectation": "会议恰为周二10:30到11:15，共45分钟。",
      "required": true
    },
    {
      "id": "c2",
      "step_id": "s4",
      "metric": "application",
      "expectation": "兼容会议室时间及两名参与人的时间。",
      "required": true
    },
    {
      "id": "c3",
      "step_id": "s4",
      "metric": "fact_recall",
      "expectation": "正确关联李青11:15离开、沈知可线上参加，不交换身份。",
      "required": true
    }
  ]
}
